{"campaign_id":"luremandate-counterfactual-v1","cases":[{"case_id":"case-0001","sequence":1,"transaction":{"approvals":[{"approval_id":"cf-01-baseline-mission","approver_id":"approver-mission","approver_role":"mission-owner","decision":"approve","expires_at":"2026-09-05T15:00:01.900Z","intent_sha256":"72063604cee10b8f94fd9c60c987a7c5d50bea7779f8b857ac6c8ce84eb65419","issued_at":"2026-09-05T15:00:01.200Z","nonce":"cf-01-baseline-mission-nonce"},{"approval_id":"cf-01-baseline-security","approver_id":"approver-security","approver_role":"security-reviewer","decision":"approve","expires_at":"2026-09-05T15:00:01.900Z","intent_sha256":"72063604cee10b8f94fd9c60c987a7c5d50bea7779f8b857ac6c8ce84eb65419","issued_at":"2026-09-05T15:00:01.200Z","nonce":"cf-01-baseline-security-nonce"}],"decided_at":"2026-09-05T15:00:01.400Z","intent":{"action":"apply-change","agent_id":"agent-a","impact_units":10,"intent_id":"cf-01-baseline-intent","intent_nonce":"cf-01-baseline-intent-nonce","policy_id":"high-impact","proposed_at":"2026-09-05T15:00:01.100Z","requester_id":"requester-01","resource_id":"cf-resource-01","run_id":"mandate-counterfactual-run-1","tenant_id":"agency-tenant","workload_spiffe_id":"spiffe://example.gov/workload/agent-a"},"intent_sha256":"72063604cee10b8f94fd9c60c987a7c5d50bea7779f8b857ac6c8ce84eb65419","transaction_id":"cf-01-baseline"}},{"case_id":"case-0002","sequence":2,"transaction":{"approvals":[{"approval_id":"cf-01-mutant-mission","approver_id":"approver-mission","approver_role":"mission-owner","decision":"approve","expires_at":"2026-09-05T15:00:02.900Z","intent_sha256":"b33240be9a890a63e6b86a66cdeb91388db7bdb86104464c352ffe511002656a","issued_at":"2026-09-05T15:00:02.200Z","nonce":"cf-01-mutant-mission-nonce"},{"approval_id":"cf-01-mutant-security","approver_id":"approver-security","approver_role":"security-reviewer","decision":"approve","expires_at":"2026-09-05T15:00:02.900Z","intent_sha256":"b33240be9a890a63e6b86a66cdeb91388db7bdb86104464c352ffe511002656a","issued_at":"2026-09-05T15:00:02.200Z","nonce":"cf-01-mutant-security-nonce"}],"decided_at":"2026-09-05T15:00:02.400Z","intent":{"action":"apply-change","agent_id":"agent-a","impact_units":10,"intent_id":"cf-01-mutant-intent","intent_nonce":"cf-01-mutant-intent-nonce","policy_id":"unknown-policy","proposed_at":"2026-09-05T15:00:02.100Z","requester_id":"requester-01","resource_id":"cf-resource-01","run_id":"mandate-counterfactual-run-1","tenant_id":"agency-tenant","workload_spiffe_id":"spiffe://example.gov/workload/agent-a"},"intent_sha256":"b33240be9a890a63e6b86a66cdeb91388db7bdb86104464c352ffe511002656a","transaction_id":"cf-01-mutant"}},{"case_id":"case-0003","sequence":3,"transaction":{"approvals":[{"approval_id":"cf-02-baseline-mission","approver_id":"approver-mission","approver_role":"mission-owner","decision":"approve","expires_at":"2026-09-05T15:00:03.900Z","intent_sha256":"59d9a8c787148a50d490cdaf06ce3f6a09d211c38c4f2ecd8f4dc53f1bdbd48a","issued_at":"2026-09-05T15:00:03.200Z","nonce":"cf-02-baseline-mission-nonce"},{"approval_id":"cf-02-baseline-security","approver_id":"approver-security","approver_role":"security-reviewer","decision":"approve","expires_at":"2026-09-05T15:00:03.900Z","intent_sha256":"59d9a8c787148a50d490cdaf06ce3f6a09d211c38c4f2ecd8f4dc53f1bdbd48a","issued_at":"2026-09-05T15:00:03.200Z","nonce":"cf-02-baseline-security-nonce"}],"decided_at":"2026-09-05T15:00:03.400Z","intent":{"action":"apply-change","agent_id":"agent-a","impact_units":10,"intent_id":"cf-02-baseline-intent","intent_nonce":"cf-02-baseline-intent-nonce","policy_id":"high-impact","proposed_at":"2026-09-05T15:00:03.100Z","requester_id":"requester-02","resource_id":"cf-resource-02","run_id":"mandate-counterfactual-run-1","tenant_id":"agency-tenant","workload_spiffe_id":"spiffe://example.gov/workload/agent-a"},"intent_sha256":"59d9a8c787148a50d490cdaf06ce3f6a09d211c38c4f2ecd8f4dc53f1bdbd48a","transaction_id":"cf-02-baseline"}},{"case_id":"case-0004","sequence":4,"transaction":{"approvals":[{"approval_id":"cf-02-mutant-mission","approver_id":"approver-mission","approver_role":"mission-owner","decision":"approve","expires_at":"2026-09-05T15:00:04.900Z","intent_sha256":"0d04c5b931127cb4f1ff150bbaac940a240d04c9a3141e3af910bca978f8e614","issued_at":"2026-09-05T15:00:04.200Z","nonce":"cf-02-mutant-mission-nonce"},{"approval_id":"cf-02-mutant-security","approver_id":"approver-security","approver_role":"security-reviewer","decision":"approve","expires_at":"2026-09-05T15:00:04.900Z","intent_sha256":"0d04c5b931127cb4f1ff150bbaac940a240d04c9a3141e3af910bca978f8e614","issued_at":"2026-09-05T15:00:04.200Z","nonce":"cf-02-mutant-security-nonce"}],"decided_at":"2026-09-05T15:00:04.400Z","intent":{"action":"apply-change","agent_id":"agent-a","impact_units":10,"intent_id":"cf-02-mutant-intent","intent_nonce":"cf-02-mutant-intent-nonce","policy_id":"high-impact","proposed_at":"2026-09-05T15:00:04.100Z","requester_id":"requester-02","resource_id":"cf-resource-02","run_id":"mandate-counterfactual-run-1","tenant_id":"other-tenant","workload_spiffe_id":"spiffe://example.gov/workload/agent-a"},"intent_sha256":"0d04c5b931127cb4f1ff150bbaac940a240d04c9a3141e3af910bca978f8e614","transaction_id":"cf-02-mutant"}},{"case_id":"case-0005","sequence":5,"transaction":{"approvals":[{"approval_id":"cf-03-baseline-mission","approver_id":"approver-mission","approver_role":"mission-owner","decision":"approve","expires_at":"2026-09-05T15:00:05.900Z","intent_sha256":"94fff730e607fb130eeede06d96e878781a22d1eb9404b766960747510026777","issued_at":"2026-09-05T15:00:05.200Z","nonce":"cf-03-baseline-mission-nonce"},{"approval_id":"cf-03-baseline-security","approver_id":"approver-security","approver_role":"security-reviewer","decision":"approve","expires_at":"2026-09-05T15:00:05.900Z","intent_sha256":"94fff730e607fb130eeede06d96e878781a22d1eb9404b766960747510026777","issued_at":"2026-09-05T15:00:05.200Z","nonce":"cf-03-baseline-security-nonce"}],"decided_at":"2026-09-05T15:00:05.400Z","intent":{"action":"apply-change","agent_id":"agent-a","impact_units":10,"intent_id":"cf-03-baseline-intent","intent_nonce":"cf-03-baseline-intent-nonce","policy_id":"high-impact","proposed_at":"2026-09-05T15:00:05.100Z","requester_id":"requester-03","resource_id":"cf-resource-03","run_id":"mandate-counterfactual-run-1","tenant_id":"agency-tenant","workload_spiffe_id":"spiffe://example.gov/workload/agent-a"},"intent_sha256":"94fff730e607fb130eeede06d96e878781a22d1eb9404b766960747510026777","transaction_id":"cf-03-baseline"}},{"case_id":"case-0006","sequence":6,"transaction":{"approvals":[{"approval_id":"cf-03-mutant-mission","approver_id":"approver-mission","approver_role":"mission-owner","decision":"approve","expires_at":"2026-09-05T15:00:06.900Z","intent_sha256":"7bd30df04b59dd4eb5d82744ddf8376c6c2d54008b641149a413382678c2dd5b","issued_at":"2026-09-05T15:00:06.200Z","nonce":"cf-03-mutant-mission-nonce"},{"approval_id":"cf-03-mutant-security","approver_id":"approver-security","approver_role":"security-reviewer","decision":"approve","expires_at":"2026-09-05T15:00:06.900Z","intent_sha256":"7bd30df04b59dd4eb5d82744ddf8376c6c2d54008b641149a413382678c2dd5b","issued_at":"2026-09-05T15:00:06.200Z","nonce":"cf-03-mutant-security-nonce"}],"decided_at":"2026-09-05T15:00:06.400Z","intent":{"action":"apply-change","agent_id":"agent-a","impact_units":10,"intent_id":"cf-03-mutant-intent","intent_nonce":"cf-03-mutant-intent-nonce","policy_id":"high-impact","proposed_at":"2026-09-05T15:00:06.100Z","requester_id":"requester-03","resource_id":"cf-resource-03","run_id":"other-run","tenant_id":"agency-tenant","workload_spiffe_id":"spiffe://example.gov/workload/agent-a"},"intent_sha256":"7bd30df04b59dd4eb5d82744ddf8376c6c2d54008b641149a413382678c2dd5b","transaction_id":"cf-03-mutant"}},{"case_id":"case-0007","sequence":7,"transaction":{"approvals":[{"approval_id":"cf-04-baseline-mission","approver_id":"approver-mission","approver_role":"mission-owner","decision":"approve","expires_at":"2026-09-05T15:00:07.900Z","intent_sha256":"6d16ecd3d5f960d2b504eabee794d7bff0aad3c04aeb30384cd7044ccbe451f1","issued_at":"2026-09-05T15:00:07.200Z","nonce":"cf-04-baseline-mission-nonce"},{"approval_id":"cf-04-baseline-security","approver_id":"approver-security","approver_role":"security-reviewer","decision":"approve","expires_at":"2026-09-05T15:00:07.900Z","intent_sha256":"6d16ecd3d5f960d2b504eabee794d7bff0aad3c04aeb30384cd7044ccbe451f1","issued_at":"2026-09-05T15:00:07.200Z","nonce":"cf-04-baseline-security-nonce"}],"decided_at":"2026-09-05T15:00:07.400Z","intent":{"action":"apply-change","agent_id":"agent-a","impact_units":10,"intent_id":"cf-04-baseline-intent","intent_nonce":"cf-04-baseline-intent-nonce","policy_id":"high-impact","proposed_at":"2026-09-05T15:00:07.100Z","requester_id":"requester-04","resource_id":"cf-resource-04","run_id":"mandate-counterfactual-run-1","tenant_id":"agency-tenant","workload_spiffe_id":"spiffe://example.gov/workload/agent-a"},"intent_sha256":"6d16ecd3d5f960d2b504eabee794d7bff0aad3c04aeb30384cd7044ccbe451f1","transaction_id":"cf-04-baseline"}},{"case_id":"case-0008","sequence":8,"transaction":{"approvals":[{"approval_id":"cf-04-mutant-mission","approver_id":"approver-mission","approver_role":"mission-owner","decision":"approve","expires_at":"2026-09-05T15:00:08.900Z","intent_sha256":"ac35b623099f1a7c9667e7ba5c8f913d183c173619a920a68c0a3942f10e16c4","issued_at":"2026-09-05T15:00:08.200Z","nonce":"cf-04-mutant-mission-nonce"},{"approval_id":"cf-04-mutant-security","approver_id":"approver-security","approver_role":"security-reviewer","decision":"approve","expires_at":"2026-09-05T15:00:08.900Z","intent_sha256":"ac35b623099f1a7c9667e7ba5c8f913d183c173619a920a68c0a3942f10e16c4","issued_at":"2026-09-05T15:00:08.200Z","nonce":"cf-04-mutant-security-nonce"}],"decided_at":"2026-09-05T15:00:08.400Z","intent":{"action":"apply-change","agent_id":"agent-a","impact_units":10,"intent_id":"cf-04-mutant-intent","intent_nonce":"cf-04-mutant-intent-nonce",